{
  "name": "animation01",
  "model": "data/models/model2/model2.blend",
  "seed": 2073686946,
  "duration_ns": 4000000000,
  "event_count": 8,
  "events": [
    {
      "t_ns": 0,
      "asset": "Left_three",
      "kind": "pose"
    },
    {
      "t_ns": 1705881817,
      "asset": "Look_At_Hand",
      "kind": "pose"
    },
    {
      "t_ns": 2088984161,
      "asset": "Wave_Animation",
      "kind": "action",
      "duration_ns": 330229499,
      "source_frames": [
        1,
        50
      ]
    },
    {
      "t_ns": 2419213660,
      "asset": "Right_ok",
      "kind": "pose"
    },
    {
      "t_ns": 3041699611,
      "asset": "Look_At_Hand",
      "kind": "pose"
    },
    {
      "t_ns": 3490314790,
      "asset": "Right_Pat",
      "kind": "pose"
    },
    {
      "t_ns": 3630820766,
      "asset": "Right_four",
      "kind": "pose"
    },
    {
      "t_ns": 4000000000,
      "asset": "Right_ok",
      "kind": "pose"
    }
  ]
}
